### ISSUE TITLE
Trouble with Discovery service - Talos 1.9.2 - Kubernetes - 1.32.1

### ISSUE THREAD

**Issue by savagemindz** [siderolabs/talos#10222]
## Bug Report
2025-01-24T18:04:21.623Z [31mERROR[0m hello failed {"component": "controller-runtime", "controller": "cluster.DiscoveryServiceController", "error": "rpc error: code = Unavailable desc = connection error: desc = \"transport: authentication handshake failed: context deadline exceeded\"", "endpoint": "discovery.talos.dev:443"}

### Description

Hi all,

I am sure I am doing something stupid but figured I would open this in case it is a bug (or you can educate me).

I have been playing with Talos in lab using terraform to provision it on a small proxmox cluster. All the VMs get created fine and I can bootstrap the first control plane node but all nodes then fail to connect to discovery.talos.dev. The logs fill with...

2025-01-24T18:04:21.623Z [31mERROR[0m hello failed {"component": "controller-runtime", "controller": "cluster.DiscoveryServiceController", "error": "rpc error: code = Unavailable desc = connection error: desc = \"transport: authentication handshake failed: context deadline exceeded\"", "endpoint": "discovery.talos.dev:443"}

At this point the cluster sort of builds but my call to talosctl health results in nodes only being able to see themselves.

talosctl health -n k8s-cp-1
discovered nodes: ["192.168.2.81"]
waiting for etcd to be healthy: ...
waiting for etcd to be healthy: OK
waiting for etcd members to be consistent across nodes: ...
waiting for etcd members to be consistent across nodes: OK
waiting for etcd members to be control plane nodes: ...
waiting for etcd members to be control plane nodes: etcd member ips ["192.168.2.82" "192.168.2.83" "192.168.2.81"] are not subset of control plane node ips ["192.168.2.81" "2001:4d48:ad5e:e02:b8d0:ff:fe01:1"]

Interestingly kubernetes does seem to make the cluster though

kg nodes
NAME       STATUS   ROLES           AGE   VERSION
k8s-cp-1   Ready    control-plane   19m   v1.32.1
k8s-cp-2   Ready    control-plane   17m   v1.32.1
k8s-cp-3   Ready    control-plane   18m   v1.32.1
k8s-wk-1   Ready    <none>          18m   v1.32.1
k8s-wk-2   Ready    <none>          19m   v1.32.1

There are no firewall rules preventing outbound connectivity to discovery.talos.dev:443 and a curl from a machine on the same network works fine. I have checked all the obvious things I can think of such as NTP, network reachability, DNS etc.

If I downgrade to kubernetes 1.31 and use the kubernetes registry I can get the cluster to build.

In case this matters I am trying to build with cilium as an inline manifest.

Anyway let me know if you need any more info or what me to run something but I am at a bit of a loss.

Thanks
iain

### Logs
[support.zip](https://github.com/user-attachments/files/18543859/support.zip)

### Environment

- Talos version: [`talosctl version --nodes <problematic nodes>`]

talosctl version --nodes 192.168.2.81                                                                                 ✔  py3.12 Py 
Client:
        Tag:         v1.8.3
        SHA:         6494aced
        Built:       
        Go version:  go1.22.9
        OS/Arch:     linux/amd64
Server:
        NODE:        192.168.2.81
        Tag:         v1.9.2
        SHA:         09758b3f
        Built:       
        Go version:  go1.23.4
        OS/Arch:     linux/amd64
        Enabled:     RBAC

- Kubernetes version: [`kubectl version --short`]
kubectl version                                                                                       1 ✘  py3.12 Py  admin@k8s ○ 
Client Version: v1.32.0
Kustomize Version: v5.5.0
Server Version: v1.32.1

- Platform:

**Comment by savagemindz** [comment]
Just to add to this I booted the cluster using the kubernetes registry and kubernetes version 1.31.5 and then edited the machine config for each node and rebooted one of them (so far). The node that rebooted still prints the "transport: authentication handshake failed: context deadline exceeded" error. "talosctl get affiliates --namespace=cluster-raw" also only has entries from the k8s service. Nothing appears from the discovery service. my machine config look like this anyway.

`    discovery:
        enabled: true
        registries:
            kubernetes:
                disabled: false
            service:
                disabled: false
`

One other thing that I thought might be relevant. The cluster is using an image generated by https://factory.talos.dev/. It has  these additional options added to it.

-  "iscsi-tools",
- "qemu-guest-agent",
- "util-linux-tools"

Thanks
iain

**Comment by smira** [comment]
It's an interesting issue, I don't see why it would fail. 

Can you try `time curl -v -X HEAD https://discovery.talos.dev` from a pod on the node?

```
kubectl debug -it node/talos-default-worker-1 --image alpine --profile=baseline
```

**Comment by savagemindz** [comment]
Hey,

Looks like this fails for v6 (need to look at that) but works for v4. Could that be the source of my issue?

Output below.

Thanks
iain


` /g/dev  kubectl debug -it node/k8s-wk-1 --image alpine/curl --profile=baseline -- /bin/sh                      ✔  4s  py3.12 Py  admin@k8s ○ 
Creating debugging pod node-debugger-k8s-wk-1-dxftb with container debugger on node k8s-wk-1.
Warning: would violate PodSecurity "restricted:latest": allowPrivilegeEscalation != false (container "debugger" must set securityContext.allowPrivilegeEscalation=false), unrestricted capabilities (container "debugger" must set securityContext.capabilities.drop=["ALL"]), runAsNonRoot != true (pod or container "debugger" must set securityContext.runAsNonRoot=true), seccompProfile (pod or container "debugger" must set securityContext.seccompProfile.type to "RuntimeDefault" or "Localhost")
If you don't see a command prompt, try pressing enter.
/ # time curl -v -X HEAD https://discovery.talos.dev
Warning: Setting custom HTTP method to HEAD with -X/--request may not work the way you want. Consider using -I/--head instead.
* Host discovery.talos.dev:443 was resolved.
* IPv6: 2a01:111:f100:2000::a83e:3731
* IPv4: 172.174.35.21
*   Trying [2a01:111:f100:2000::a83e:3731]:443...
* Immediate connect fail for 2a01:111:f100:2000::a83e:3731: Network unreachable
*   Trying 172.174.35.21:443...
* ALPN: curl offers h2,http/1.1
* TLSv1.3 (OUT), TLS handshake, Client hello (1):
*  CAfile: /etc/ssl/cert.pem
*  CApath: none
* TLSv1.3 (IN), TLS handshake, Server hello (2):
* TLSv1.3 (IN), TLS handshake, Encrypted Extensions (8):
* TLSv1.3 (IN), TLS handshake, Certificate (11):
* TLSv1.3 (IN), TLS handshake, CERT verify (15):
* TLSv1.3 (IN), TLS handshake, Finished (20):
* TLSv1.3 (OUT), TLS change cipher, Change cipher spec (1):
* TLSv1.3 (OUT), TLS handshake, Finished (20):
* SSL connection using TLSv1.3 / TLS_AES_128_GCM_SHA256 / x25519 / RSASSA-PSS
* ALPN: server accepted h2
* Server certificate:
*  subject: CN=discovery.talos.dev
*  start date: Dec  6 06:52:36 2024 GMT
*  expire date: Mar  6 06:52:35 2025 GMT
*  subjectAltName: host "discovery.talos.dev" matched cert's "discovery.talos.dev"
*  issuer: C=US; O=Let's Encrypt; CN=R11
*  SSL certificate verify ok.
*   Certificate level 0: Public key type RSA (2048/112 Bits/secBits), signed using sha256WithRSAEncryption
*   Certificate level 1: Public key type RSA (2048/112 Bits/secBits), signed using sha256WithRSAEncryption
*   Certificate level 2: Public key type RSA (4096/152 Bits/secBits), signed using sha256WithRSAEncryption
* Connected to discovery.talos.dev (172.174.35.21) port 443
* using HTTP/2
* [HTTP/2] [1] OPENED stream for https://discovery.talos.dev/
* [HTTP/2] [1] [:method: HEAD]
* [HTTP/2] [1] [:scheme: https]
* [HTTP/2] [1] [:authority: discovery.talos.dev]
* [HTTP/2] [1] [:path: /]
* [HTTP/2] [1] [user-agent: curl/8.11.1]
* [HTTP/2] [1] [accept: */*]
> HEAD / HTTP/2
> Host: discovery.talos.dev
> User-Agent: curl/8.11.1
> Accept: */*
> 
* TLSv1.3 (IN), TLS handshake, Newsession Ticket (4):
* Request completely sent off
< HTTP/2 200 
< accept-ranges: bytes
< content-type: text/html; charset=utf-8
< content-length: 2422
< date: Mon, 27 Jan 2025 13:28:51 GMT
< 
* end of response with 2422 bytes missing
* Connection #0 to host discovery.talos.dev left intact
curl: (18) end of response with 2422 bytes missing
Command exited with non-zero status 18
real    0m 0.41s
user    0m 0.02s
sys     0m 0.00s`

**Comment by smira** [comment]
It might be that, if you have IPv6 not configured properly, but still some address assigned.

**Comment by savagemindz** [comment]
So I don't have ipv6 configured in kubernetes/cilium. v6 is available on the host network though and the talos hosts do have v6 addresses assign. Testing from another machine on the subnet seems to work fine for v6.

I did open ping to one of the talos hosts and pinged it from the internet so v6 to the talos host works.

Is there a way to test from the talos host itself?

**Comment by smira** [comment]
In the command above, `kubectl debug node`, change `--profile` to `sysadmin`, it should give you a host-level pod.

**Comment by savagemindz** [comment]
ok figured I would try.

`  /g/dev  kubectl debug -it node/k8s-wk-1 --image alpine/curl --profile=sysadmin -n kube-system -- /bin/sh               1 ✘  py3.12 Py  admin@k8s ○ 
Creating debugging pod node-debugger-k8s-wk-1-gqqqw with container debugger on node k8s-wk-1.
If you don't see a command prompt, try pressing enter.
/ # time curl -v -X HEAD https://discovery.talos.dev
Warning: Setting custom HTTP method to HEAD with -X/--request may not work the way you want. Consider using -I/--head instead.
* Host discovery.talos.dev:443 was resolved.
* IPv6: 2a01:111:f100:2000::a83e:3731
* IPv4: 172.174.35.21
*   Trying [2a01:111:f100:2000::a83e:3731]:443...
* ALPN: curl offers h2,http/1.1
* TLSv1.3 (OUT), TLS handshake, Client hello (1):
*  CAfile: /etc/ssl/cert.pem
*  CApath: none
^CCommand terminated by signal 2
real    1m 11.73s
user    0m 0.02s
sys     0m 0.00s
`

So I started a debug container as you suggested and this does indeed hang. Doing it to the v4 address works fine.

`/ # time curl -v -X HEAD https://172.174.35.21
Warning: Setting custom HTTP method to HEAD with -X/--request may not work the way you want. Consider using -I/--head instead.
*   Trying 172.174.35.21:443...
* ALPN: curl offers h2,http/1.1
* TLSv1.3 (OUT), TLS handshake, Client hello (1):
*  CAfile: /etc/ssl/cert.pem
*  CApath: none
* TLSv1.3 (IN), TLS handshake, Server hello (2):
* TLSv1.3 (IN), TLS handshake, Encrypted Extensions (8):
* TLSv1.3 (IN), TLS handshake, Certificate (11):
* TLSv1.3 (IN), TLS handshake, CERT verify (15):
* TLSv1.3 (IN), TLS handshake, Finished (20):
* TLSv1.3 (OUT), TLS change cipher, Change cipher spec (1):
* TLSv1.3 (OUT), TLS handshake, Finished (20):
* SSL connection using TLSv1.3 / TLS_AES_128_GCM_SHA256 / x25519 / RSASSA-PSS
* ALPN: server accepted h2
* Server certificate:
*  subject: CN=discovery.talos.dev
*  start date: Dec  6 06:52:36 2024 GMT
*  expire date: Mar  6 06:52:35 2025 GMT
*  subjectAltName does not match ipv4 address 172.174.35.21
* SSL: no alternative certificate subject name matches target ipv4 address '172.174.35.21'
* closing connection #0
curl: (60) SSL: no alternative certificate subject name matches target ipv4 address '172.174.35.21'
More details here: https://curl.se/docs/sslcerts.html

curl failed to verify the legitimacy of the server and therefore could not
establish a secure connection to it. To learn more about this situation and
how to fix it, please visit the webpage mentioned above.
Command exited with non-zero status 60
real    0m 0.19s
user    0m 0.01s
sys     0m 0.01s`

So I did a packet capture on the proxmox host and I can see traffic going in btoh directions but it does look like something is dropping it somewhere...

`root@p1:~# tcpdump -i bond0 ip6 and port 443 -v
tcpdump: listening on bond0, link-type EN10MB (Ethernet), snapshot length 262144 bytes
17:26:49.001879 IP6 (flowlabel 0x5d1bb, hlim 64, next-header TCP (6) payload length: 40) 2001:4d48:ad5e:e02:b8d0:ff:fe11:1.47238 > 2a01:111:f100:2000::a83e:3731.https: Flags [S], cksum 0xfc3d (incorrect -> 0x6e79), seq 1737919804, win 64800, options [mss 1440,sackOK,TS val 1272964470 ecr 0,nop,wscale 7], length 0
17:26:49.088908 IP6 (flowlabel 0xf2c0d, hlim 46, next-header TCP (6) payload length: 40) 2a01:111:f100:2000::a83e:3731.https > 2001:4d48:ad5e:e02:b8d0:ff:fe11:1.47238: Flags [S.], cksum 0xb619 (correct), seq 1395177134, ack 1737919805, win 32844, options [mss 1400,sackOK,TS val 3200281779 ecr 1272964470,nop,wscale 7], length 0
17:26:49.088981 IP6 (flowlabel 0x5d1bb, hlim 64, next-header TCP (6) payload length: 32) 2001:4d48:ad5e:e02:b8d0:ff:fe11:1.47238 > 2a01:111:f100:2000::a83e:3731.https: Flags [.], cksum 0xfc35 (incorrect -> 0x62a4), ack 1, win 507, options [nop,nop,TS val 1272964557 ecr 3200281779], length 0
17:26:49.092330 IP6 (flowlabel 0x5d1bb, hlim 64, next-header TCP (6) payload length: 549) 2001:4d48:ad5e:e02:b8d0:ff:fe11:1.47238 > 2a01:111:f100:2000::a83e:3731.https: Flags [P.], cksum 0xfe3a (incorrect -> 0xbf99), seq 1:518, ack 1, win 507, options [nop,nop,TS val 1272964560 ecr 3200281779], length 517
17:26:49.179756 IP6 (flowlabel 0xf2c0d, hlim 46, next-header TCP (6) payload length: 32) 2a01:111:f100:2000::a83e:3731.https > 2001:4d48:ad5e:e02:b8d0:ff:fe11:1.47238: Flags [.], cksum 0x613f (correct), ack 518, win 253, options [nop,nop,TS val 3200281870 ecr 1272964560], length 0
17:26:49.181742 IP6 (flowlabel 0xf2c0d, hlim 46, next-header TCP (6) payload length: 438) 2a01:111:f100:2000::a83e:3731.https > 2001:4d48:ad5e:e02:b8d0:ff:fe11:1.47238: Flags [P.], cksum 0x8083 (correct), seq 2857:3263, ack 518, win 253, options [nop,nop,TS val 3200281872 ecr 1272964560], length 406
17:26:49.181780 IP6 (flowlabel 0x5d1bb, hlim 64, next-header TCP (6) payload length: 44) 2001:4d48:ad5e:e02:b8d0:ff:fe11:1.47238 > 2a01:111:f100:2000::a83e:3731.https: Flags [.], cksum 0xfc41 (incorrect -> 0xfe39), ack 1, win 507, options [nop,nop,TS val 1272964650 ecr 3200281870,nop,nop,sack 1 {2857:3263}], length 0
17:26:59.176912 IP6 (flowlabel 0x8d417, hlim 46, next-header TCP (6) payload length: 32) 2a01:111:f100:2000::a83e:3731.https > 2001:4d48:ad5e:e02:b8d0:ff:fe11:1.47238: Flags [F.], cksum 0x2d19 (correct), seq 3263, ack 518, win 253, options [nop,nop,TS val 3200291867 ecr 1272964650], length 0
17:26:59.177105 IP6 (flowlabel 0x5d1bb, hlim 64, next-header TCP (6) payload length: 44) 2001:4d48:ad5e:e02:b8d0:ff:fe11:1.47238 > 2a01:111:f100:2000::a83e:3731.https: Flags [.], cksum 0xfc41 (incorrect -> 0xd72d), ack 1, win 507, options [nop,nop,TS val 1272974645 ecr 3200281870,nop,nop,sack 1 {2857:3264}], length 0
17:27:57.171396 IP6 (flowlabel 0x3ffc0, hlim 64, next-header TCP (6) payload length: 44) 2001:4d48:ad5e:e02:b8d0:ff:fe11:1.53840 > 2a01:111:f100:2000::a83e:3731.https: Flags [F.], cksum 0xfc41 (incorrect -> 0x69a9), seq 425762652, ack 3314831322, win 507, options [nop,nop,TS val 1273032640 ecr 3200251363,nop,nop,sack 1 {2857:4208}], length 0
17:27:57.259548 IP6 (flowlabel 0xfbfbb, hlim 44, next-header TCP (6) payload length: 32) 2a01:111:f100:2000::a83e:3731.https > 2001:4d48:ad5e:e02:b8d0:ff:fe11:1.53840: Flags [.], cksum 0x55ac (correct), ack 1, win 249, options [nop,nop,TS val 3200349950 ecr 1273032640], length 0
17:27:59.285624 IP6 (flowlabel 0x5d1bb, hlim 64, next-header TCP (6) payload length: 44) 2001:4d48:ad5e:e02:b8d0:ff:fe11:1.47238 > 2a01:111:f100:2000::a83e:3731.https: Flags [.], cksum 0xfc41 (incorrect -> 0xec60), ack 1, win 507, options [nop,nop,TS val 1273034754 ecr 3200281870,nop,nop,sack 1 {2857:3264}], length 0
17:27:59.372872 IP6 (flowlabel 0x69d9a, hlim 46, next-header TCP (6) payload length: 32) 2a01:111:f100:2000::a83e:3731.https > 2001:4d48:ad5e:e02:b8d0:ff:fe11:1.47238: Flags [.], cksum 0x1ae9 (correct), ack 518, win 253, options [nop,nop,TS val 3200352063 ecr 1272974645], length 0
17:28:17.240589 IP6 (flowlabel 0x8930d, hlim 64, next-header TCP (6) payload length: 44) 2001:4d48:ad5e:e02:b8d0:ff:fe01:1.58736 > 2a01:111:f100:2000::a83e:3731.https: Flags [F.], cksum 0xfc31 (incorrect -> 0xf7dc), seq 3187449798, ack 3302135570, win 507, options [nop,nop,TS val 2061550709 ecr 3297497781,nop,nop,sack 1 {2857:4208}], length 0
17:28:17.328697 IP6 (flowlabel 0xe3316, hlim 46, next-header TCP (6) payload length: 32) 2a01:111:f100:2000::a83e:3731.https > 2001:4d48:ad5e:e02:b8d0:ff:fe01:1.58736: Flags [.], cksum 0x2cb1 (correct), ack 1, win 249, options [nop,nop,TS val 3297613803 ecr 2061550709], length 0
`

**Comment by savagemindz** [comment]
ok  a load more testing. discovery.talos.dev hangs but other ipv6 websites work ok. 

for example
,/ # curl -v https://[2001:470:1f1d:275::222] --insecure
*   Trying [2001:470:1f1d:275::222]:443...
* ALPN: curl offers h2,http/1.1
* TLSv1.3 (OUT), TLS handshake, Client hello (1):
* TLSv1.3 (IN), TLS handshake, Server hello (2):
* TLSv1.3 (IN), TLS handshake, Encrypted Extensions (8):
* TLSv1.3 (IN), TLS handshake, Certificate (11):
* TLSv1.3 (IN), TLS handshake, CERT verify (15):
* TLSv1.3 (IN), TLS handshake, Finished (20):
* TLSv1.3 (OUT), TLS change cipher, Change cipher spec (1):
* TLSv1.3 (OUT), TLS handshake, Finished (20):
* SSL connection using TLSv1.3 / TLS_AES_256_GCM_SHA384 / x25519 / id-ecPublicKey
* ALPN: server accepted h2
* Server certificate:
*  subject: CN=6deploy.eu
* ....,

**Comment by savagemindz** [comment]
Hey @smira,

Just to let you know I got to thie bottom of this. I had ...

        net.bridge.bridge-nf-call-ip6tables: "1"
        net.bridge.bridge-nf-call-iptables: "1"

in my machine.sysctls. Not sure where I got that from but that was the culprit. The discovery service is now working for me. Hopefully this saves someone else the time in the future too. :)

Anyway thanks for your help. 

iain
