### ISSUE TITLE
Unable to install: disk doesn't match

### ISSUE THREAD

**Issue by tnielsen2** [siderolabs/talos#11967]
### Description
I have 5 bare-metal machines I am attempting to install Talos on. I am unable to install Talos using the start guide and issuing the apply-config command for the first time.  I see some volume errors after booting from usb and after attempting apply-config.

I have used the generic config from generation, and I have also attempted to specify the install disk.

These hosts only have a single nvme0n1 drive. There is no SATA and the device is booting from a USB stick. 

It isn't clear to me whether I need to declare a volume or if Talos should detect this block device and make the necessary configurations to detect and provision the volume with default settings.

I have generated the ISO from imagefactory with and without some extensions, for bare metal UEFI bios.

What am I doing wrong here?

Here is my install config. I have tried both options below.
w/o specifying disk selector
```
    install:
        disk: /dev/nvme0n1
        image: ghcr.io/siderolabs/installer:v1.11.2
        wipe: false
        
```

w/ specifying disk selector
```
    install:
        disk: /dev/nvme0n1 # The disk used for installations.
        image: ghcr.io/siderolabs/installer:v1.11.2 # Allows for supplying the image used to perform the installation.
        wipe: true # Indicates if the installation disk should be wiped at installation time.
        
         diskSelector:
            size: 1.0TB
            model: NX*
            busPath: /pci0000:00/0000:00:1b.0/0000:01:00.0/nvme

        extraKernelArgs:
            - talos.platform=metal
```

Here is the disk info:

```

node:
metadata:
    namespace: runtime
    type: Disks.block.talos.dev
    id: nvme0n1
    version: 2
    owner: block.DisksController
    phase: running
    created: 2025-09-28T11:25:51Z
    updated: 2025-09-28T11:25:51Z
spec:
    dev_path: /dev/nvme0n1
    size: 1024209543168
    pretty_size: 1.0 TB
    io_size: 512
    sector_size: 512
    readonly: false
    cdrom: false
    model: NX-1TB 2280
    serial: 9I50412053871
    wwid: nvme.1e4b-39493530343132303533383731-4e582d3154422032323830-00000001
    bus_path: /pci0000:00/0000:00:1b.0/0000:01:00.0/nvme
    sub_system: /sys/class/block
    transport: nvme
    symlinks:
        - /dev/disk/by-diskseq/12
        - /dev/disk/by-id/nvme-NX-1TB_2280_9I50412053871
        - /dev/disk/by-id/nvme-NX-1TB_2280_9I50412053871_1
        - /dev/disk/by-id/nvme-nvme.1e4b-39493530343132303533383731-4e582d3154422032323830-00000001
        - /dev/disk/by-path/pci-0000:01:00.0-nvme-1
```

### Logs

Logs right after booting from usb that are relevant:
```
[talos] volume status {"component"L "controller-runtime", "controller": "block.VolumeManagerController", "volume": "META", "phase": "waiting --> missing"}
[talos] volume status {"component"L "controller-runtime", "controller": "block.VolumeManagerController", "volume": "STATE", "phase": "waiting --> missing"}
```

After install command
```
[talos] volume status {"component"L "controller-runtime", "controller": "block.VolumeManagerController", "volume": "STATE", "phase": "missing --> failed", "error": "error evaluating disk locator: no such attribute(s): system_disk}
[talos] volume status {"component"L "controller-runtime", "controller": "block.VolumeManagerController", "volume": "STATE", "phase": "failed --> failed", "error": "error evaluating disk locator: no such attribute(s): system_disk}
[talos] volume status {"component"L "controller-runtime", "controller": "block.VolumeManagerController", "volume": "STATE", "phase": "failed --> failed", "error": "error evaluating disk locator: no such attribute(s): system_disk}

```

### Environment

- Talos version: [`talosctl version --nodes <problematic nodes>`]
```
➜  talos talosctl version --nodes 192.168.1.18
Client:
	Tag:         v1.11.2
	SHA:         undefined
	Built:       2025-09-25T13:54:03Z
	Go version:  go1.25.1
	OS/Arch:     darwin/arm64
```
- Kubernetes version: [`kubectl version`]
Whatever 1.11.2 installs with. 
Local machine kubectl version:
```
kubectl version
Client Version: v1.32.2
Kustomize Version: v5.5.0
```
- Platform:
Bare Metal

**Comment by smira** [comment]
This error `error": "error evaluating disk locator: no such attribute(s): system_disk` and be ignored, it just means that system disk (where Talos got installed) is not available yet.

Your issue is with the install process, and you need to look into the log around the time install runs (or doesn't run). 

Your disk selector seems to be over specific, or you can simply put `/dev/nvme0n1` as the direct disk name.

**Comment by tnielsen2** [comment]
Thank you for getting back to me. I have tried to use a disk selector as you have suggested and still have the same issue. After issuing the install command, the device hangs in a "Installing" state and never installs. It gets to a point where it loops at trying to reach itself on port 6443 but never gets that far. 

Initial boot log:
<img width="1598" height="935" alt="Image" src="https://github.com/user-attachments/assets/5be6dd42-6d5f-4684-bc26-efd055b0af03" />

After issuing the install command:
<img width="1589" height="936" alt="Image" src="https://github.com/user-attachments/assets/0b7459b5-1387-4015-b87a-e11cf967f63b" />

**Comment by frezbo** [comment]
it seems the installer hasn't finished pulling

**Comment by smira** [comment]
I think installer started, but not sure why it seems to be hanging.

**Comment by tnielsen2** [comment]
it will sit like this for days and be stuck in installing. 

<img width="1514" height="883" alt="Image" src="https://github.com/user-attachments/assets/9f4d1789-ad0b-4b75-a57e-d3a0f9577976" />


At first, when trying to call the endpoint, it will give the error:

`rpc error: code = Unavailable desc = connection error: desc = "transport: Error while dialing: dial tcp 192.168.1.15:50000: connect: connection refused"`

Then after a while, (not sure how long, i step away for hours or days and return)

`rpc error: code = Unavailable desc = connection error: desc = "transport: Error while dialing: dial tcp 192.168.1.15:50000: i/o timeout"`

I assume it has to do with the host disk somehow, or at least, I assume, based on this screenshot.

<img width="1680" height="966" alt="Image" src="https://github.com/user-attachments/assets/c1391d1f-0962-48b1-b983-939740ec23bf" />

Any guidance on what I can do to provide more detailed logging/troubleshooting I am happing to do.

**Comment by smira** [comment]
I'm curious what might be wrong with your specific setup, but I have no clue. It seems to be hanging around very simple initial setup, but we don't have more detailed logs to see why it does this.

**Comment by tnielsen2** [comment]
Is there anything I can do in order to gather information for this troubleshooting? If I was to install another distro, and gather hardware level information would that be helpful in any capacity?

**Comment by smira** [comment]
Ah, remove `wipe: true` from your machine config.

**Comment by sander85** [comment]
Removing "wipe: true" didn't help. And if I gave it wrong disk path the installer failed fast and rebooted.

**Comment by suse-coder** [comment]
I get the same error. Installer hangs (has downloded it sucessfully). I am on hyper-v with the 1.11.5 version. Could it be related to Windows 25h2?

use the default adapter in hyper-v

<img width="1015" height="826" alt="Image" src="https://github.com/user-attachments/assets/30f3d6c0-f681-4acf-8d18-ad4f59e45db7" />

on the older 1.9.0 Version which worked on win 11 23h2 it also now does not work (win 25h2):

<img width="1004" height="843" alt="Image" src="https://github.com/user-attachments/assets/1eb31e83-b1da-439a-99a8-32eb51582bae" />
No write to the disk is done

```
version: v1alpha1 # Indicates the schema used to decode the contents.
debug: false # Enable verbose logging to the console.
persist: true
# Provides machine specific configuration options.
machine:
    type: controlplane # Defines the role of the machine within the cluster.
    token: j7sd4e.c3yn6zl3vlacum79 # The `token` is used by a machine to join the PKI of the cluster.
    # The root certificate authority of the PKI.
    ca:
        crt: LS0tLS1CRUdJTiBDRVJUSUZJQ0FURS0tLS0tCk1JSUJQakNCOGFBREFnRUNBaEJNQXBBRW5JTTVVYTl2SXBXMC9md1lNQVVHQXl0bGNEQVFNUTR3REFZRFZRUUsKRXdWMFlXeHZjekFlRncweU5UQXhNekF5TWpJM01qaGFGdzB6TlRBeE1qZ3lNakkzTWpoYU1CQXhEakFNQmdOVgpCQW9UQlhSaGJHOXpNQ293QlFZREsyVndBeUVBOVhCWTdac2VXVDFZSXVjSmVTT2NwOC8rK0FsblJnU09LbHNuCm44OEJNMzZqWVRCZk1BNEdBMVVkRHdFQi93UUVBd0lDaERBZEJnTlZIU1VFRmpBVUJnZ3JCZ0VGQlFjREFRWUkKS3dZQkJRVUhBd0l3RHdZRFZSMFRBUUgvQkFVd0F3RUIvekFkQmdOVkhRNEVGZ1FVTjVZcm53bG0wU0E0clJUbApGSU1MUWo5OVVlZ3dCUVlESzJWd0EwRUE5dDFmMFExbXd3Ni9VTU45UkZDakZnbVZDaUJpVEptdE9STE9hRVZICngvc2JUd0dhbUlDNVo3Q1JPS0QwNXg3R1AvcFJmTXZtNGgvQTNFZkdXMnVRQ0E9PQotLS0tLUVORCBDRVJUSUZJQ0FURS0tLS0tCg==
        key: LS0tLS1CRUdJTiBFRDI1NTE5IFBSSVZBVEUgS0VZLS0tLS0KTUM0Q0FRQXdCUVlESzJWd0JDSUVJSVVuRDh0ZTBUZys3VjRGZ04rU3lkb1B4UUJ2dUpOcVQ2bjUzeGN1MlNPYQotLS0tLUVORCBFRDI1NTE5IFBSSVZBVEUgS0VZLS0tLS0K
    # Extra certificate subject alternative names for the machine's certificate.
    certSANs: []
    #   # Uncomment this to enable SANs.
    #   - 10.0.0.10
    #   - 172.16.0.10
    #   - 192.168.0.10

    # Used to provide additional options to the kubelet.
    kubelet:
        image: ghcr.io/siderolabs/kubelet:v1.34.1 # The `image` field is an optional reference to an alternative kubelet image.
        defaultRuntimeSeccompProfileEnabled: true # Enable container runtime default Seccomp profile.
        disableManifestsDirectory: true # The `disableManifestsDirectory` field configures the kubelet to get static pod manifests from the /etc/kubernetes/manifests directory.
        
        # # The `ClusterDNS` field is an optional reference to an alternative kubelet clusterDNS ip list.
        # clusterDNS:
        #     - 10.96.0.10
        #     - 169.254.2.53

        # # The `extraArgs` field is used to provide additional flags to the kubelet.
        # extraArgs:
        #     key: value

        # # The `extraMounts` field is used to add additional mounts to the kubelet container.
        # extraMounts:
        #     - destination: /var/lib/example # Destination is the absolute path where the mount will be placed in the container.
        #       type: bind # Type specifies the mount kind.
        #       source: /var/lib/example # Source specifies the source path of the mount.
        #       # Options are fstab style mount options.
        #       options:
        #         - bind
        #         - rshared
        #         - rw

        # # The `extraConfig` field is used to provide kubelet configuration overrides.
        # extraConfig:
        #     serverTLSBootstrap: true

        # # The `KubeletCredentialProviderConfig` field is used to provide kubelet credential configuration.
        # credentialProviderConfig:
        #     apiVersion: kubelet.config.k8s.io/v1
        #     kind: CredentialProviderConfig
        #     providers:
        #         - apiVersion: credentialprovider.kubelet.k8s.io/v1
        #           defaultCacheDuration: 12h
        #           matchImages:
        #             - '*.dkr.ecr.*.amazonaws.com'
        #             - '*.dkr.ecr.*.amazonaws.com.cn'
        #             - '*.dkr.ecr-fips.*.amazonaws.com'
        #             - '*.dkr.ecr.us-iso-east-1.c2s.ic.gov'
        #             - '*.dkr.ecr.us-isob-east-1.sc2s.sgov.gov'
        #           name: ecr-credential-provider

        # # The `nodeIP` field is used to configure `--node-ip` flag for the kubelet.
        # nodeIP:
        #     # The `validSubnets` field configures the networks to pick kubelet node IP from.
        #     validSubnets:
        #         - 10.0.0.0/8
        #         - '!10.0.0.3/32'
        #         - fdc7::/16
    # Provides machine specific network configuration options.
    network: {}
    # # `interfaces` is used to define the network interface configuration.
    # interfaces:
    #     - interface: enp0s1 # The interface name.
    #       # Assigns static IP addresses to the interface.
    #       addresses:
    #         - 192.168.2.0/24
    #       # A list of routes associated with the interface.
    #       routes:
    #         - network: 0.0.0.0/0 # The route's network (destination).
    #           gateway: 192.168.2.1 # The route's gateway (if empty, creates link scope route).
    #           metric: 1024 # The optional metric for the route.
    #       mtu: 1500 # The interface's MTU.
    #       
    #       # # Picks a network device using the selector.

    #       # # select a device with bus prefix 00:*.
    #       # deviceSelector:
    #       #     busPath: 00:* # PCI, USB bus prefix, supports matching by wildcard.
    #       # # select a device with mac address matching `*:f0:ab` and `virtio` kernel driver.
    #       # deviceSelector:
    #       #     hardwareAddr: '*:f0:ab' # Device hardware (MAC) address, supports matching by wildcard.
    #       #     driver: virtio_net # Kernel driver, supports matching by wildcard.
    #       # # select a device with bus prefix 00:*, a device with mac address matching `*:f0:ab` and `virtio` kernel driver.
    #       # deviceSelector:
    #       #     - busPath: 00:* # PCI, USB bus prefix, supports matching by wildcard.
    #       #     - hardwareAddr: '*:f0:ab' # Device hardware (MAC) address, supports matching by wildcard.
    #       #       driver: virtio_net # Kernel driver, supports matching by wildcard.

    #       # # Bond specific options.
    #       # bond:
    #       #     # The interfaces that make up the bond.
    #       #     interfaces:
    #       #         - enp2s0
    #       #         - enp2s1
    #       #     # Picks a network device using the selector.
    #       #     deviceSelectors:
    #       #         - busPath: 00:* # PCI, USB bus prefix, supports matching by wildcard.
    #       #         - hardwareAddr: '*:f0:ab' # Device hardware (MAC) address, supports matching by wildcard.
    #       #           driver: virtio_net # Kernel driver, supports matching by wildcard.
    #       #     mode: 802.3ad # A bond option.
    #       #     lacpRate: fast # A bond option.

    #       # # Bridge specific options.
    #       # bridge:
    #       #     # The interfaces that make up the bridge.
    #       #     interfaces:
    #       #         - enxda4042ca9a51
    #       #         - enxae2a6774c259
    #       #     # Enable STP on this bridge.
    #       #     stp:
    #       #         enabled: true # Whether Spanning Tree Protocol (STP) is enabled.

    #       # # Configure this device as a bridge port.
    #       # bridgePort:
    #       #     master: br0 # The name of the bridge master interface

    #       # # Indicates if DHCP should be used to configure the interface.
    #       # dhcp: true

    #       # # DHCP specific options.
    #       # dhcpOptions:
    #       #     routeMetric: 1024 # The priority of all routes received via DHCP.

    #       # # Wireguard specific configuration.

    #       # # wireguard server example
    #       # wireguard:
    #       #     privateKey: ABCDEF... # Specifies a private key configuration (base64 encoded).
    #       #     listenPort: 51111 # Specifies a device's listening port.
    #       #     # Specifies a list of peer configurations to apply to a device.
    #       #     peers:
    #       #         - publicKey: ABCDEF... # Specifies the public key of this peer.
    #       #           endpoint: 192.168.1.3 # Specifies the endpoint of this peer entry.
    #       #           # AllowedIPs specifies a list of allowed IP addresses in CIDR notation for this peer.
    #       #           allowedIPs:
    #       #             - 192.168.1.0/24
    #       # # wireguard peer example
    #       # wireguard:
    #       #     privateKey: ABCDEF... # Specifies a private key configuration (base64 encoded).
    #       #     # Specifies a list of peer configurations to apply to a device.
    #       #     peers:
    #       #         - publicKey: ABCDEF... # Specifies the public key of this peer.
    #       #           endpoint: 192.168.1.2:51822 # Specifies the endpoint of this peer entry.
    #       #           persistentKeepaliveInterval: 10s # Specifies the persistent keepalive interval for this peer.
    #       #           # AllowedIPs specifies a list of allowed IP addresses in CIDR notation for this peer.
    #       #           allowedIPs:
    #       #             - 192.168.1.0/24

    #       # # Virtual (shared) IP address configuration.

    #       # # layer2 vip example
    #       # vip:
    #       #     ip: 172.16.199.55 # Specifies the IP address to be used.

    # # Used to statically set the nameservers for the machine.
    # nameservers:
    #     - 8.8.8.8
    #     - 1.1.1.1

    # # Used to statically set arbitrary search domains.
    # searchDomains:
    #     - example.org
    #     - example.com

    # # Allows for extra entries to be added to the `/etc/hosts` file
    # extraHostEntries:
    #     - ip: 192.168.1.100 # The IP of the host.
    #       # The host alias.
    #       aliases:
    #         - example
    #         - example.domain.tld

    # # Configures KubeSpan feature.
    # kubespan:
    #     enabled: true # Enable the KubeSpan feature.

    # Used to provide instructions for installations.
    install:
        disk: /dev/sda # The disk used for installations.
        image: ghcr.io/siderolabs/installer:v1.11.5 # Allows for supplying the image used to perform the installation.
        wipe: false # Indicates if the installation disk should be wiped at installation time.
        
        # # Look up disk using disk attributes like model, size, serial and others.
        # diskSelector:
        #     size: 4GB # Disk size.
        #     model: WDC* # Disk model `/sys/block/<dev>/device/model`.
        #     busPath: /pci0000:00/0000:00:17.0/ata1/host0/target0:0:0/0:0:0:0 # Disk bus path.

        # # Allows for supplying extra kernel args via the bootloader.
        # extraKernelArgs:
        #     - talos.platform=metal
        #     - reboot=k
    # Used to configure the machine's container image registry mirrors.
    registries: {}
    # # Specifies mirror configuration for each registry host namespace.
    # mirrors:
    #     ghcr.io:
    #         # List of endpoints (URLs) for registry mirrors to use.
    #         endpoints:
    #             - https://registry.insecure
    #             - https://ghcr.io/v2/

    # # Specifies TLS & auth configuration for HTTPS image registries.
    # config:
    #     registry.insecure:
    #         # The TLS configuration for the registry.
    #         tls:
    #             insecureSkipVerify: true # Skip TLS server certificate verification (not recommended).
    #             
    #             # # Enable mutual TLS authentication with the registry.
    #             # clientIdentity:
    #             #     crt: LS0tIEVYQU1QTEUgQ0VSVElGSUNBVEUgLS0t
    #             #     key: LS0tIEVYQU1QTEUgS0VZIC0tLQ==
    #         
    #         # # The auth configuration for this registry.
    #         # auth:
    #         #     username: username # Optional registry authentication.
    #         #     password: password # Optional registry authentication.

    # Features describe individual Talos features that can be switched on or off.
    features:
        rbac: true # Enable role-based access control (RBAC).
        stableHostname: true # Enable stable default hostname.
        apidCheckExtKeyUsage: true # Enable checks for extended key usage of client certificates in apid.
        diskQuotaSupport: true # Enable XFS project quota support for EPHEMERAL partition and user disks.
        # KubePrism - local proxy/load balancer on defined port that will distribute
        kubePrism:
            enabled: true # Enable KubePrism support - will start local load balancing proxy.
            port: 7445 # KubePrism port.
        # Configures host DNS caching resolver.
        hostDNS:
            enabled: true # Enable host DNS caching resolver.
            forwardKubeDNSToHost: true # Use the host DNS resolver as upstream for Kubernetes CoreDNS pods.
        
        # # Configure Talos API access from Kubernetes pods.
        # kubernetesTalosAPIAccess:
        #     enabled: true # Enable Talos API access from Kubernetes pods.
        #     # The list of Talos API roles which can be granted for access from Kubernetes pods.
        #     allowedRoles:
        #         - os:reader
        #     # The list of Kubernetes namespaces Talos API access is available from.
        #     allowedKubernetesNamespaces:
        #         - kube-system
    # Configures the node labels for the machine.
    nodeLabels:
        node.kubernetes.io/exclude-from-external-load-balancers: ""
    
    # # Provides machine specific control plane configuration options.

    # # ControlPlane definition example.
    # controlPlane:
    #     # Controller manager machine specific configuration options.
    #     controllerManager:
    #         disabled: false # Disable kube-controller-manager on the node.
    #     # Scheduler machine specific configuration options.
    #     scheduler:
    #         disabled: true # Disable kube-scheduler on the node.

    # # Used to provide static pod definitions to be run by the kubelet directly bypassing the kube-apiserver.

    # # nginx static pod.
    # pods:
    #     - apiVersion: v1
    #       kind: pod
    #       metadata:
    #         name: nginx
    #       spec:
    #         containers:
    #             - image: nginx
    #               name: nginx

    # # Allows the addition of user specified files.

    # # MachineFiles usage example.
    # files:
    #     - content: '...' # The contents of the file.
    #       permissions: 0o666 # The file's permissions in octal.
    #       path: /tmp/file.txt # The path of the file.
    #       op: append # The operation to use

    # # The `env` field allows for the addition of environment variables.

    # # Environment variables definition examples.
    # env:
    #     GRPC_GO_LOG_SEVERITY_LEVEL: info
    #     GRPC_GO_LOG_VERBOSITY_LEVEL: "99"
    #     https_proxy: http://SERVER:PORT/
    # env:
    #     GRPC_GO_LOG_SEVERITY_LEVEL: error
    #     https_proxy: https://USERNAME:PASSWORD@SERVER:PORT/
    # env:
    #     https_proxy: http://DOMAIN\USERNAME:PASSWORD@SERVER:PORT/

    # # Used to configure the machine's time settings.

    # # Example configuration for cloudflare ntp server.
    # time:
    #     disabled: false # Indicates if the time service is disabled for the machine.
    #     # description: |
    #     servers:
    #         - time.cloudflare.com
    #     bootTimeout: 2m0s # Specifies the timeout when the node time is considered to be in sync unlocking the boot sequence.

    # # Used to configure the machine's sysctls.

    # # MachineSysctls usage example.
    # sysctls:
    #     kernel.domainname: talos.dev
    #     net.ipv4.ip_forward: "0"
    #     net/ipv6/conf/eth0.100/disable_ipv6: "1"

    # # Used to configure the machine's sysfs.

    # # MachineSysfs usage example.
    # sysfs:
    #     devices.system.cpu.cpu0.cpufreq.scaling_governor: performance

    # # Configures the udev system.
    # udev:
    #     # List of udev rules to apply to the udev system
    #     rules:
    #         - SUBSYSTEM=="drm", KERNEL=="renderD*", GROUP="44", MODE="0660"

    # # Configures the logging system.
    # logging:
    #     # Logging destination.
    #     destinations:
    #         - endpoint: tcp://1.2.3.4:12345 # Where to send logs. Supported protocols are "tcp" and "udp".
    #           format: json_lines # Logs format.

    # # Configures the kernel.
    # kernel:
    #     # Kernel modules to load.
    #     modules:
    #         - name: brtfs # Module name.

    # # Configures the seccomp profiles for the machine.
    # seccompProfiles:
    #     - name: audit.json # The `name` field is used to provide the file name of the seccomp profile.
    #       # The `value` field is used to provide the seccomp profile.
    #       value:
    #         defaultAction: SCMP_ACT_LOG

    # # Override (patch) settings in the default OCI runtime spec for CRI containers.

    # # override default open file limit
    # baseRuntimeSpecOverrides:
    #     process:
    #         rlimits:
    #             - hard: 1024
    #               soft: 1024
    #               type: RLIMIT_NOFILE

    # # Configures the node annotations for the machine.

    # # node annotations example.
    # nodeAnnotations:
    #     customer.io/rack: r13a25

    # # Configures the node taints for the machine. Effect is optional.

    # # node taints example.
    # nodeTaints:
    #     exampleTaint: exampleTaintValue:NoSchedule
# Provides cluster specific configuration options.
cluster:
    id: 6KmHOMwksNXEcJ9QjrgQBTEPcC_1hq6gxErP9O8XF1Q= # Globally unique identifier for this cluster (base64 encoded random 32 bytes).
    secret: tfc0KhjPRIcenqNEEqPreN+HAVoFqXR2HrGOTKEIH6g= # Shared secret of cluster (base64 encoded random 32 bytes).
    # Provides control plane specific configuration options.
    controlPlane:
        endpoint: https://172.27.167.220:6443 # Endpoint is the canonical controlplane endpoint, which can be an IP address or a DNS hostname.
    clusterName: talos-cluster # Configures the cluster's name.
    # Provides cluster specific network configuration options.
    network:
        dnsDomain: cluster.local # The domain used by Kubernetes DNS.
        # The pod subnet CIDR.
        podSubnets:
            - 10.244.0.0/16
        # The service subnet CIDR.
        serviceSubnets:
            - 10.96.0.0/12
        
        # # The CNI used.
        # cni:
        #     name: custom # Name of CNI to use.
        #     # URLs containing manifests to apply for the CNI.
        #     urls:
        #         - https://docs.projectcalico.org/archive/v3.20/manifests/canal.yaml
    token: 37dsr1.wajq043tao9ht6yj # The [bootstrap token](https://kubernetes.io/docs/reference/access-authn-authz/bootstrap-tokens/) used to join the cluster.
    secretboxEncryptionSecret: ZUOu/qvOA9TgWFA/dRhjHsETacS3GQMq5SVr5UM4cxk= # A key used for the [encryption of secret data at rest](https://kubernetes.io/docs/tasks/administer-cluster/encrypt-data/).
    # The base64 encoded root certificate authority used by Kubernetes.
    ca:
        crt: LS0tLS1CRUdJTiBDRVJUSUZJQ0FURS0tLS0tCk1JSUJpVENDQVRDZ0F3SUJBZ0lSQU1EQ0NOcnhuUkFxWll6RERGVWxsUXN3Q2dZSUtvWkl6ajBFQXdJd0ZURVQKTUJFR0ExVUVDaE1LYTNWaVpYSnVaWFJsY3pBZUZ3MHlOVEF4TXpBeU1qSTNNamhhRncwek5UQXhNamd5TWpJMwpNamhhTUJVeEV6QVJCZ05WQkFvVENtdDFZbVZ5Ym1WMFpYTXdXVEFUQmdjcWhrak9QUUlCQmdncWhrak9QUU1CCkJ3TkNBQVIyV2tKMlBBTlp0a3NzWmtQYlRpS0FVdGZIa0tHY1JUQTRKNyt3c3BML2NaMXREWTJ2ZHE2WGxmQ0sKdW1pR092eWFIMWk2cUJySEV1VUJvWDFrUUFHK28yRXdYekFPQmdOVkhROEJBZjhFQkFNQ0FvUXdIUVlEVlIwbApCQll3RkFZSUt3WUJCUVVIQXdFR0NDc0dBUVVGQndNQ01BOEdBMVVkRXdFQi93UUZNQU1CQWY4d0hRWURWUjBPCkJCWUVGR2xndjBkQW5DbmFuMUs5S3FaaGZoVlBmVlJtTUFvR0NDcUdTTTQ5QkFNQ0EwY0FNRVFDSUI0R2xLRW4KTlFoQU0rR05qM0hLcEN5MVgvYWdQc20yZTJhTU9WVEFGTXFWQWlCNDF4SVM2OEpWYW53SEwydmF6eENyaUZyegpBMUE1T0E2QjhlQU16RmdjQ0E9PQotLS0tLUVORCBDRVJUSUZJQ0FURS0tLS0tCg==
        key: LS0tLS1CRUdJTiBFQyBQUklWQVRFIEtFWS0tLS0tCk1IY0NBUUVFSUcvWTIvbDF5aTBWcjZJaldWbUVaRTZGak8xL1BRd0ZIQ3VOc0owQXhQMGVvQW9HQ0NxR1NNNDkKQXdFSG9VUURRZ0FFZGxwQ2Rqd0RXYlpMTEdaRDIwNGlnRkxYeDVDaG5FVXdPQ2Uvc0xLUy8zR2RiUTJOcjNhdQpsNVh3aXJwb2hqcjhtaDlZdXFnYXh4TGxBYUY5WkVBQnZnPT0KLS0tLS1FTkQgRUMgUFJJVkFURSBLRVktLS0tLQo=
    # The base64 encoded aggregator certificate authority used by Kubernetes for front-proxy certificate generation.
    aggregatorCA:
        crt: LS0tLS1CRUdJTiBDRVJUSUZJQ0FURS0tLS0tCk1JSUJYekNDQVFhZ0F3SUJBZ0lSQUtIUnc2cEkvVENaUkF3SjVMVXIrK0l3Q2dZSUtvWkl6ajBFQXdJd0FEQWUKRncweU5UQXhNekF5TWpJM01qaGFGdzB6TlRBeE1qZ3lNakkzTWpoYU1BQXdXVEFUQmdjcWhrak9QUUlCQmdncQpoa2pPUFFNQkJ3TkNBQVR0YlNZVU9FenRHL29QVXVOZUxINXJDVW1WajM3cDFWR0hvaU82QTRkSE9XQUUxbmw1CitHWE5QSGJ6ejdUOE9UZUw4UmJ4SVhjTkp3aEk0cmNFajRkWW8yRXdYekFPQmdOVkhROEJBZjhFQkFNQ0FvUXcKSFFZRFZSMGxCQll3RkFZSUt3WUJCUVVIQXdFR0NDc0dBUVVGQndNQ01BOEdBMVVkRXdFQi93UUZNQU1CQWY4dwpIUVlEVlIwT0JCWUVGSEM4emlBYTlubWJRSEtXbUtwWUI4eWVOQ3RNTUFvR0NDcUdTTTQ5QkFNQ0EwY0FNRVFDCklENXE5MTVxZ1BQTnZCR0dZV0E1QjRoTFV5dGkxdS85UXQvMTFqZmpKd3R6QWlBcmk1MXBsRWpUSjBOM1czZjYKTHJmejdwMlhFT3NQTkcybjV0T3VYZFFHdEE9PQotLS0tLUVORCBDRVJUSUZJQ0FURS0tLS0tCg==
        key: LS0tLS1CRUdJTiBFQyBQUklWQVRFIEtFWS0tLS0tCk1IY0NBUUVFSUdHTUhERjdTVlFPSzB4bG11VURCYXpJVjNvak1FcElnWUU5Z0RMbXRWYmFvQW9HQ0NxR1NNNDkKQXdFSG9VUURRZ0FFN1cwbUZEaE03UnY2RDFMalhpeCthd2xKbFk5KzZkVlJoNklqdWdPSFJ6bGdCTlo1ZWZobAp6VHgyODgrMC9EazNpL0VXOFNGM0RTY0lTT0szQkkrSFdBPT0KLS0tLS1FTkQgRUMgUFJJVkFURSBLRVktLS0tLQo=
    # The base64 encoded private key for service account token generation.
    serviceAccount:
        key: LS0tLS1CRUdJTiBSU0EgUFJJVkFURSBLRVktLS0tLQpNSUlKS0FJQkFBS0NBZ0VBMHU5ZnZGZENrTkZhclg5ZjFmRXkzV3lMZVUzREFyRTM0RkNZZGEwanZzZWM5WDN5CmZ4NjJoRXVBZGQreTVTTXk1Rko3VlJvb0VxYjQ5ZWYyTnlVckszVXVhMFZyWUZRb3FTampzYURmeE1sRm5DREoKaGRVbXRRSzFNWnI5Vmp0Q0Z0OEw4WkNhZU9sZHFkTUlqOTZlV0FWdTFQdldhWk93YXArSGlqSXdJdS9qWW1xbwpvcjJ0TU94YjZaT09UcTljS3k4d0dCekxXQ0s4QkFGSnc4NVdsVGVpRUh6eFMzK0t1TXppckdzYWNsSFM1akVuCnAxVjNIWFpjbTNJbWl6S3NTd1ptdjJkUGNKV2xoVU1UQUMrRWMwWUd6bTAvcmhZbWQ2Q2d0d0JuY0RmT3NqYSsKcHNtWDBwZkg3czgwTU5Wc1JnbHJjSWR0RUJkb2NMYXVtWW52Umo4MFppbnlSQ0ZBNi9qdmQzWXZYeU80azU4cAozMUJiSTNhN3FxUEYxR1IvNEdwWUdOUFo3d2lUUzd1QUhicTA0U0M1dmJrSXh0L0Z5OGVLaXM3eEUvVHY5YUh0CmhiYzlQODJQQmFLVk1XQ2VQVENkN0M5UURXd2EzYVV5Q2YrSjVBdHJORC9mZWUzWkNNUnptb0E2ZU1YZFN3Y1MKdlMrN0MwZzZLaU9aQmtSMkRXUFFMbUNQRGkvMEVzOVhqRm1iVVcraDlaSXVNN0tJaDlLQ3hDSG1FYmszdmx5YwpIZ3JBbEFMTWtkNjVSWWhQWm9XM25LaU1aZmRBSCtjUVlyK3VoU2txbGwxbUIrcHE1Tys2WkJaTi9wWk9uYTcyCmIvTlNuSXhhZ25yRXNXUnQ0S1FTd3pEdjR3UjRnU0pGM29RZHJHUGlnbjNpNDNUOUhJaTFzczFiZy8wQ0F3RUEKQVFLQ0FnQmhPNXJEOU8xb1dEa1dkUHEyWWlMeVV0RFFML3BPeVdaYWJveDQ0a0R4OW8zeDFBYnVkamZvTCsyZAphR3JNbVRjaWJLc1JoYWNuUWZUTlZnbjNUWmppeFhlS1YwdXg4ZGwwY0xiVThMVjF2dG5wcUd0ODE4NnA3ZitjClNEZXpna2xxeFpKNTNoQjI0QXdlOW5xaDV4clN0RjVzcTFJaEJNVnp3T24zMkQ2OFBCeHpCM3VJMlNwMnZOMTUKaEYwN0JEYldhVUFnUFZXMjRQd09WSkd1UXZWQ2Y0eWpVUlRobW45VnhJeFFzbVpVZ0VkWmVSc3dWWU04LzR5YwowemZWUHB5UlVQZ1lEd1ZkZm4zNE9mME9QdGt0VWdCZE01c0JJcERFNERSMVp5aEhZRkpWY0VyZUUxdDY1aUJ4Cmd1NHAvSmVXaVUwUGFEM3NCdjVMeHNvaFdLWUV3eExnVVpHbER4Z1hXazNtOFZjME9XK2RiM0VwZTc3eG1jMEwKNWtpdXhSSVFmbUdrYWlVOVpwWTJMQnlSa1lQd3V2QjZ5S3dHR1A2aXpmSTJmaEpJUm1xZVJhSXg4MVdXemhGawpFd1dhQ2wvVlVjWkQ3TXpZbEtwbFM2SHpNdzFFVkxPRFJLNDZVSFdaTlZGKzhmUG8wV3ozNWo3OWRGdzQ4SzZhClE4MW5LamNNZDFLZFk0eks2QmhXWVRrMElWVnY2QmpUYVM0R09qYjI1ZWZIZ2crN1ArQndHWG9KMVY2TjNrL0gKYjNtVW9xd2ZVc3lLRWUyTDZuUEVEd1QrUGtJcElpYU9wSHVXaWdiTGdYRmVoN1NLU3M1NURjcDZJRHRHc1dneQoxbGFML0V6aG9ZSXZ0QUlYaWU4YWl4UTdTZG5sK1doN3hQMXVFWlBPL3Z4a3Nmay9BUUtDQVFFQTIyeGtUQnhxCnAxSng3MHU2ZHJtQXZvY2JxeGQvQ0ppV0dlbDk1MUNuTWJGN0tDNXlYRWxyMm5ENklvUHdtM1BlYmJvUHlDTmIKZDRQZ0lEenlDTkdGUmVJN0ZwMWdsc3ByTGNVbEgvVDUweS9sV3Nwc3BZNmtWSUFXYWJ6dkxIOUJJck9Vak9OQwpGMzhtNUp4ZlRzZ2N2ajZ1MVVFVExycm5RaHhwY2dnMXhSSW5BMCtPTU1qOVBoOVlrYVJYTFhjRFpQMUpsTDkrClFBRGdFeEozNDVoUmswRlYxYUxkVVlFR25EWm1IM0V1bVNqODFSRHZaQ3pBVXJMOGVhSkgzUDNkbDBIVSt3N2wKZzdhUVAwblJoVGhDK0l3TFJsK3RYOWFERExhSWZtTzZuMmxUUG9BeFlWNk9lTnZESld1UTZHbldBeDNrOUEyZwpjaEFCb0s1RHlEdnJJUUtDQVFFQTloakF1MEw5VUt1WWt4eUVMWFRGVXQrdjJ5TGIwdUg2dU04MkhUV0hIQjlwCksyOHFFZjkxUkhEaUpRVTJWMUo3WEpxNDdqWW5TTlJqR1NzV1BOOGVOZlBQTDB4YUtUK2N5SWV0UVlPbWk1b0oKcUVYOEZJVDZwV0l3YVZlWFdacmVqS2dxMysrSVZhcGF1UmR4OEtGVk9PZ0FOaXJIaEJSUWx1eVB2b2lqSmQ1eQpBallkdkhtR1oyZm1jZmltTmhPNEd6WlR6eStpRzQ4NHV4Z2ZTQmJUN2hJUlZKR3NISUp6NHZpZng1eUdFOFN3Cngzc3lvSTZsTDJqRGVsNldQVmQyVlZLVzBaNkN4VjFrTWRTZDhsdUdYdjY0dmlXRGwxcWVrWmtQVmZpbFpSbjkKL3dXRWpra2VXR2dsK3JHYm1qTjFJdFlIS2JwQkxDbHJGS3ppRDJUNVhRS0NBUUIxbWZtRGhYTndMRkxlVXpNago4TFpjNTJMZjV4N3h4MzRqY3k1RXJNaC9iTVU2T3ZLV0hjL05hdUhWWCt1MEZYendTRm12QmF3L09SSUZsVVNQCmoyUWptV1hiOEF0VnBqV2RlVjAxYklIOU8xMXN0TE5ZWkVRVStmV0pSSGJYM1hoV2xmTVhNN0kzajdHVHMyK3QKZExsYkNaT0F2bmorZ2JQeWpmSEI2VDZRV2ZOSTVmbXFrZjZRcmhJMU5PUjRmS0g0SFh5eldaTGIwTnhIdkkwLwpFV01mVGxRbnhUdGpOSWtMYm1oN2o1alBBOVhHaUdZVnhacHFlSDJ5MzFRdTBHMVVaVGMyTzd5dFJFcTVjT0gzCnliaXpKN1BmU3VaTVNGZENtQTQ5MTB1dHByQ3ovZGI1ZmNsVVkweUxJTVN3bkJEVTZNL09NZ045UHJEd29wVzMKbXMyaEFvSUJBQWF3RTRURFJFa044TDZHdHR6WllJZHBCc2xvd0JxU0E1TkVKazlTNWhJUWxIWVd0a2o0N1VIbgo0MjFvSDlydHBlYVZXZE0zYTRmaUpiTklaWGxRQXUwcWJBWDRDRGM0d0ZUK3d1bVYzMC9KNXR0STA1bm5KenlaClY0RjFYT3FWZDlqUXRTR1N5OXl3SFhrTU53OTRBdTNoK0NlQXNCMVp3L3JtQU40SHJvOVg1VGRFS3ppMUFMOE0KcHNtUUhVdzQ2dmJxV2dxMlc2eHVEdmVlcHpMNVU5Y1RiSjhrdWsyb0NlZ3dJMzkwTkh5VENzN1EvVVk1dWlsNApxbDlIOU1ORC9qWkJZVkhmQWVURkxmVGd0MDRmeUo0S1JCRCt5ZjJ4Kzc4dkxxaUNjbFEyQ1o0RmsxMmVoUkdYCit2ZytIV0ZxWnBPRXgzc04wYm1XZ285MFIweHR6UTBDZ2dFQkFKU1RrNi9obldpK3dWbklEQkpwQ0lMUlFyckUKclo2TC9neDY3KzdrVXNodFg1ZExpdmpjUTRBSXk3azZSNTUrN3hPbVVNZGN0cFVLWHg5UThReWorRVJvTVNudwpYaStuRlVEQlBFOXBmVHF1WHJ1YTF1WVFzd0xzR244NXdkaFllbGhmc2tkQmJCOFYyLzg0SmMyNWY0UFF5bW1SCkJXMFcvakUyd2FUNDQrRGxCQTdDNlhFbXR4UXpoRmk0YkNvOWV0dTUzUU5mSUJVVlhPY0MxaFJRR1BtZVAvUXIKd0w5SlN6VUZCb2VjZWpUcGkzTkJQZnJWcjlQT1k3VlpROSs3djdKb3l4UEp5U2NDZjljUUJZZ0gxam53bzQ2MApxVk1VWitLOVJoV2daT3R6VXBYdVNDRnZsRHMzN0VTem1xTVdWcVRkbDVYZndzM0QrWHZ5TVdiMXB0QT0KLS0tLS1FTkQgUlNBIFBSSVZBVEUgS0VZLS0tLS0K
    # API server specific configuration options.
    apiServer:
        image: registry.k8s.io/kube-apiserver:v1.34.1 # The container image used in the API server manifest.
        # Extra certificate subject alternative names for the API server's certificate.
        certSANs:
            - 172.27.167.220
        disablePodSecurityPolicy: true # Disable PodSecurityPolicy in the API server and default manifests.
        # Configure the API server admission plugins.
        admissionControl:
            - name: PodSecurity # Name is the name of the admission controller.
              # Configuration is an embedded configuration object to be used as the plugin's
              configuration:
                apiVersion: pod-security.admission.config.k8s.io/v1alpha1
                defaults:
                    audit: restricted
                    audit-version: latest
                    enforce: baseline
                    enforce-version: latest
                    warn: restricted
                    warn-version: latest
                exemptions:
                    namespaces:
                        - kube-system
                    runtimeClasses: []
                    usernames: []
                kind: PodSecurityConfiguration
        # Configure the API server audit policy.
        auditPolicy:
            apiVersion: audit.k8s.io/v1
            kind: Policy
            rules:
                - level: Metadata
        
        # # Configure the API server authorization config. Node and RBAC authorizers are always added irrespective of the configuration.
        # authorizationConfig:
        #     - type: Webhook # Type is the name of the authorizer. Allowed values are `Node`, `RBAC`, and `Webhook`.
        #       name: webhook # Name is used to describe the authorizer.
        #       # webhook is the configuration for the webhook authorizer.
        #       webhook:
        #         connectionInfo:
        #             type: InClusterConfig
        #         failurePolicy: Deny
        #         matchConditionSubjectAccessReviewVersion: v1
        #         matchConditions:
        #             - expression: has(request.resourceAttributes)
        #             - expression: '!(\''system:serviceaccounts:kube-system\'' in request.groups)'
        #         subjectAccessReviewVersion: v1
        #         timeout: 3s
        #     - type: Webhook # Type is the name of the authorizer. Allowed values are `Node`, `RBAC`, and `Webhook`.
        #       name: in-cluster-authorizer # Name is used to describe the authorizer.
        #       # webhook is the configuration for the webhook authorizer.
        #       webhook:
        #         connectionInfo:
        #             type: InClusterConfig
        #         failurePolicy: NoOpinion
        #         matchConditionSubjectAccessReviewVersion: v1
        #         subjectAccessReviewVersion: v1
        #         timeout: 3s
    # Controller manager server specific configuration options.
    controllerManager:
        image: registry.k8s.io/kube-controller-manager:v1.34.1 # The container image used in the controller manager manifest.
    # Kube-proxy server-specific configuration options
    proxy:
        image: registry.k8s.io/kube-proxy:v1.34.1 # The container image used in the kube-proxy manifest.
        
        # # Disable kube-proxy deployment on cluster bootstrap.
        # disabled: false
    # Scheduler server specific configuration options.
    scheduler:
        image: registry.k8s.io/kube-scheduler:v1.34.1 # The container image used in the scheduler manifest.
    # Configures cluster member discovery.
    discovery:
        enabled: true # Enable the cluster membership discovery feature.
        # Configure registries used for cluster member discovery.
        registries:
            # Kubernetes registry uses Kubernetes API server to discover cluster members and stores additional information
            kubernetes:
                disabled: true # Disable Kubernetes discovery registry.
            # Service registry is using an external service to push and pull information about cluster members.
            service: {}
            # # External service endpoint.
            # endpoint: https://discovery.talos.dev/
    # Etcd specific configuration options.
    etcd:
        # The `ca` is the root certificate authority of the PKI.
        ca:
            crt: LS0tLS1CRUdJTiBDRVJUSUZJQ0FURS0tLS0tCk1JSUJmRENDQVNPZ0F3SUJBZ0lRVEJ6U2xCS0k0RUZGMjJIYncrdkhMakFLQmdncWhrak9QUVFEQWpBUE1RMHcKQ3dZRFZRUUtFd1JsZEdOa01CNFhEVEkxTURFek1ESXlNamN5T0ZvWERUTTFNREV5T0RJeU1qY3lPRm93RHpFTgpNQXNHQTFVRUNoTUVaWFJqWkRCWk1CTUdCeXFHU000OUFnRUdDQ3FHU000OUF3RUhBMElBQkhFU21BVDJOcXFuClpJbHhZUm5hR3BUd2lLTVA5dEdiZ2IzTnlQbm5IaVZZK1VlZjhNUHBiUVV4S01WMnl4aCtoTHAyY0ZUeStRZ1IKYXBWVVJTYkVtWnVqWVRCZk1BNEdBMVVkRHdFQi93UUVBd0lDaERBZEJnTlZIU1VFRmpBVUJnZ3JCZ0VGQlFjRApBUVlJS3dZQkJRVUhBd0l3RHdZRFZSMFRBUUgvQkFVd0F3RUIvekFkQmdOVkhRNEVGZ1FVQkFYam1UMUk4N0l6CmRabnhYSE0zYW9lSDBub3dDZ1lJS29aSXpqMEVBd0lEUndBd1JBSWdheXBrS2VVaERXUmlDUkhSR0RYUDUybmUKRXhzR3N1MHRBWFNENENpT2VCd0NJR0llMG5idFdrSE1xbHFNUjVoNnNReVFrTXpYN0dEUGk3cmZ0Um9VN3BGSAotLS0tLUVORCBDRVJUSUZJQ0FURS0tLS0tCg==
            key: LS0tLS1CRUdJTiBFQyBQUklWQVRFIEtFWS0tLS0tCk1IY0NBUUVFSUZ5d0U4UGs0UEF1V1U2M0g3cnVacGlpeUdSQnBxU3NVcS9kOUM4V3JzcDlvQW9HQ0NxR1NNNDkKQXdFSG9VUURRZ0FFY1JLWUJQWTJxcWRraVhGaEdkb2FsUENJb3cvMjBadUJ2YzNJK2VjZUpWajVSNS93dytsdApCVEVveFhiTEdINkV1blp3VlBMNUNCRnFsVlJGSnNTWm13PT0KLS0tLS1FTkQgRUMgUFJJVkFURSBLRVktLS0tLQo=
        
        # # The container image used to create the etcd service.
        # image: gcr.io/etcd-development/etcd:v3.6.5

        # # The `advertisedSubnets` field configures the networks to pick etcd advertised IP from.
        # advertisedSubnets:
        #     - 10.0.0.0/8
    # A list of urls that point to additional manifests.
    extraManifests: []
    #   - https://www.example.com/manifest1.yaml
    #   - https://www.example.com/manifest2.yaml

    # A list of inline Kubernetes manifests.
    inlineManifests: []
    #   - name: namespace-ci # Name of the manifest.
    #     contents: |- # Manifest contents as a string.
    #       apiVersion: v1
    #       kind: Namespace
    #       metadata:
    #       	name: ci

    
    # # A key used for the [encryption of secret data at rest](https://kubernetes.io/docs/tasks/administer-cluster/encrypt-data/).

    # # Decryption secret example (do not use in production!).
    # aescbcEncryptionSecret: z01mye6j16bspJYtTB/5SFX8j7Ph4JXxM2Xuu4vsBPM=

    # # Core DNS specific configuration options.
    # coreDNS:
    #     image: registry.k8s.io/coredns/coredns:v1.12.4 # The `image` field is an override to the default coredns image.

    # # External cloud provider configuration.
    # externalCloudProvider:
    #     enabled: true # Enable external cloud provider.
    #     # A list of urls that point to additional manifests for an external cloud provider.
    #     manifests:
    #         - https://raw.githubusercontent.com/kubernetes/cloud-provider-aws/v1.20.0-alpha.0/manifests/rbac.yaml
    #         - https://raw.githubusercontent.com/kubernetes/cloud-provider-aws/v1.20.0-alpha.0/manifests/aws-cloud-controller-manager-daemonset.yaml

    # # A map of key value pairs that will be added while fetching the extraManifests.
    # extraManifestHeaders:
    #     Token: "1234567"
    #     X-ExtraInfo: info

    # # Settings for admin kubeconfig generation.
    # adminKubeconfig:
    #     certLifetime: 1h0m0s # Admin kubeconfig certificate lifetime (default is 1 year).

    # # Allows running workload on control-plane nodes.
    # allowSchedulingOnControlPlanes: true

```

**Comment by suse-coder** [comment]
@smira No write are done (25h2). Maybe something with SCSI / VMBus driver with hyper-v (even though my ubuntu vm on hyper-v works fine)?

**Comment by smira** [comment]
I can't say anything without logs. Capture the installation logs and we can go from it.

**Comment by suse-coder** [comment]
Thanks. I got it working on my win 11 hyper-v as the wifi external adapter was not getting a ip from the wifi router (only with spoof mac).

Now I have created a NAT Adapter and it works:


````markdown
Download ISO over factory (metal-amd64.iso): https://factory.talos.dev/

Option 1: use NAT Adapter - preferred (with DHCP):

- download dhcpsrv2.5.2
- Use dhcpwiz.exe
- Ini

```ini
[SETTINGS]
IPPOOL_1=192.168.200.50-254
IPBIND_1=192.168.200.1
AssociateBindsToPools=1
Trace=1
DeleteOnRelease=0
ExpiredLeaseTimeout=3600

[GENERAL]
LEASETIME=31104000
NODETYPE=8
SUBNETMASK=255.255.255.0
NEXTSERVER=192.168.200.1
ROUTER_0=192.168.200.1

[DNS-SETTINGS]
EnableDNS=1
FORWARD=8.8.8.8

[TFTP-SETTINGS]
EnableTFTP=0
ROOT=C:\Users\To\Downloads\dhcpsrv2.5.2\wwwroot
WritePermission=0

[HTTP-SETTINGS]
EnableHTTP=0
ROOT=C:\Users\To\Downloads\dhcpsrv2.5.2\wwwroot

[00-15-5D-B2-72-0C]
IPADDR=192.168.200.50
AutoConfig=12/12/2025 17:08:23
LeaseEnd=1796661012
Hostname=talos-bqb-y9c
````

* Create switch

```powershell
# Create Internal vSwitch
New-VMSwitch -Name "TalosNATSwitch" -SwitchType Internal

# Assign an IP to the vSwitch interface
New-NetIPAddress -IPAddress 192.168.200.1 -PrefixLength 24 -InterfaceAlias "vEthernet (TalosNATSwitch)"

# Create a NAT
New-NetNat -Name "TalosNat" -InternalIPInterfaceAddressPrefix "192.168.200.0/24"
```

* Controlplane 

```powershell
New-TalosVM -VMNamePrefix talos-cp -CPUCount 2 -StartupMemory 8GB -SwitchName "TalosNATSwitch" -TalosISOPath C:\Users\To\Documents\Talos\metal-amd64.iso -NumberOfVMs 1 -VMDestinationBasePath 'C:\Users\To\Documents\Talos'
```

* Worker node PS

```powershell
New-TalosVM -VMNamePrefix talos-w -CPUCount 8 -StartupMemory 25GB -SwitchName "TalosNATSwitch" -TalosISOPath "C:\Users\To\Documents\Talos\metal-amd64.iso" -NumberOfVMs 1 -VMDestinationBasePath 'C:\Users\To\Documents\Talos' -StorageVHDSize 80GB

# Remove Cdrom after restart
```

**Comment by kaerbr** [comment]
I do have the same issue. If I create a VM and boot it using a talos 1.11.5-metal image I get the same output. -- I am on Windows 11 Pro. It makes no difference if I use Microsofts Hyper-V Manager or Virtualbox.
Using a dedicated Mini-PC the installation runs well with the same configuration.
As of now I do not have logs. I am trying to collect some and post them here. (:

**Comment by jrand0m** [comment]
trying to boot from sd and install on raspberry pi 4b. Same problems as op. 
talos 1.11.5.
more over - disk selector doesnt work. it just ignores it and installs on the sd card 🥲

**Comment by Turgon37** [comment]
Hello

I've the same issue on talos v1.12.2. I've manually created a fresh GTP empty partition table on the disk before install

```
└>$ talosctl -n 192.168.57.184 get --insecure disks                                                                                     [0]
NODE   NAMESPACE   TYPE   ID        VERSION   SIZE     READ ONLY   TRANSPORT   ROTATIONAL   WWID                                                           MODEL       SERIAL
       runtime     Disk   loop0     2         4.1 kB   true                                                                                                            
       runtime     Disk   loop1     2         102 kB   true                                                                                                            
       runtime     Disk   loop2     2         4.1 kB   true                                                                                                            
       runtime     Disk   loop3     2         75 MB    true                                                                                                            
       runtime     Disk   nvme0n1   2         1.0 TB   false       nvme                     nvme.1e4b-5935375430303331373654-473933324551203154-00000001   G932EQ 1T   Y57T003176T
```

```
└>$ talosctl -n 192.168.57.184 get --insecure bds
NODE   NAMESPACE   TYPE          ID        VERSION   TYPE   PARTITIONNAME   GENERATION
       runtime     BlockDevice   loop0     2         disk                   2
       runtime     BlockDevice   loop1     2         disk                   2
       runtime     BlockDevice   loop2     2         disk                   2
       runtime     BlockDevice   loop3     2         disk                   2
       runtime     BlockDevice   loop4     2         disk                   2
       runtime     BlockDevice   loop5     2         disk                   2
       runtime     BlockDevice   loop6     2         disk                   2
       runtime     BlockDevice   loop7     2         disk                   2
       runtime     BlockDevice   nvme0n1   1         disk                   1
```

I've built a iso image for bare metal with basic extensions

```
siderolabs/intel-ucode
siderolabs/util-linux-tools
```

And no other change in parameters

![Image](https://github.com/user-attachments/assets/bba6c3e0-ac43-411e-a330-8ec379ef17f3)

Talos is secured by api but in fact I can't used standard debugs tools :( like strace, lsof ....
I've inspected network traffic to help you identify where the installation process is stopped

Machine have download a huge content from 

```
23:28:05.497710 IP 10.1.0.10.35672 > 192.168.1.254.domain: 1860+ [1au] A? pkg-containers.githubusercontent.com. (65)
23:28:05.497708 IP 10.1.0.10.49198 > 192.168.1.254.domain: 10843+ [1au] AAAA? pkg-containers.githubusercontent.com. (65)
23:28:05.498209 IP 192.168.1.254.domain > 10.1.0.10.35672: 1860 4/0/1 A 185.199.109.154, A 185.199.110.154, A 185.199.108.154, A 185.199.111.154 (129)
23:28:05.498338 IP 192.168.1.254.domain > 10.1.0.10.49198: 10843 4/0/1 AAAA 2606:50c0:8003::154, AAAA 2606:50c0:8002::154, AAAA 2606:50c0:8001::154, AAAA 2606:50c0:8000::154 (177)
```

maybe the installer itself, and then the message "running Talos installer" appeared and nothing else as on the screenshot

_First_ edit

I've tried to insert another usb disk in /dev/sdb and install talos on it, it works. I suspect something related to nvme internal ssd.
